Mike,Pilkington,President,Bridgeport Coffee Company,Bridgeport Coffee Company,mike@bridgeportcoffee.net,Verified,Apollo,Apollo,"",Catch-all,2026-06-22T11:10:15+00:00,Vp,"","",mike410123024@gmail.com,"","","",'+1 773-247-9950,"",false,Cold,"","",mike410123024@gmail.com,11,food & beverages,"coffee & tea, coffee, tea, community support, chicago coffee shop, family farm coffee, sustainability, coffee for foodservice, coffee gifts, coffee retailer, relationship coffees, retailer, rainforest alliance certified, community fundraising coffee, coffee and tea manufacturing, e-commerce, neighborhood coffee shop, b2b, retail, direct trade, coffee education, specialty coffee beans, direct trade coffee, coffee subscriptions, community-focused, coffee sourcing, small batch roasting, seasonal coffee offerings, coffee beans, wholesale coffee distribution, freshly roasted coffee, private label coffee, local coffee shop, coffee roasting, coffee shop, specialty coffee, b2c, artisanal coffee, coffee quality, sustainability practices, coffee wholesale, retail coffee shops, d2c, services, labor fairness, importer of coffee beans, coffee roaster, coffee blends, coffee import, custom roasts, single origin coffee, coffee culture, distribution, consumer products & retail, food & beverages, consumer goods, consumers, environmental services, renewables & environment, consumer internet, internet, information technology & services, food, restaurants, sandwiches",http://www.linkedin.com/in/michael-pilkington-9b96b071,https://bridgeportcoffee.net,http://www.linkedin.com/company/bridgeport-coffee-company,"","",Chicago,Illinois,United States,"3101 S Morgan St, Chicago, Illinois, United States, 60608",Chicago,Illinois,United States,'+1 773-247-9950,"Google Workspace, GoDaddy Domains, Gmail, GoDaddy Hosting, Google Apps, Woo Commerce, Google Font API, Wordpress, Typekit, WordPress.org, Visual Composer, Adobe Fonts, Yoast, Mobile Friendly, Google Search Console, Viewport Meta, FlexSlider","","","","","","","","",false,false,false,false,4,2099,"311920, 722515, 445298",6a490bb567660800207fadcf,6a490bb567660800207fadd1,6a490bb567660800207fadcf,"","","","","","","","",""
Adam,Paronto,"Founder, Owner",Reprise Coffee Roasters,Reprise Coffee Roasters,adam@reprisecoffee.com,Verified,Apollo,Apollo,"","",2026-06-22T16:48:28+00:00,Owner,C-Suite,Founder,mike410123024@gmail.com,"","","",'+1 773-942-6230,"",false,Cold,"","",mike410123024@gmail.com,4,food & beverages,"coffee, coffee roaster, wholesale coffee, cafe, food & beverage services, coffee and tea manufacturing, coffee community, coffee & tea manufacturing, b2b, women in coffee, social responsibility, fermentation techniques, micro-lot coffee, fair trade coffee, rainforest preservation, coffee education, coffee craftsmanship, food & beverage, coffee environmental impact, coffee sourcing, sustainable practices, wholesale trade, community impact, coffee wholesale, direct trade, ethical sourcing, sustainable farming, coffee innovation, coffee quality, local cafes, e-commerce, direct farm relationships, consulting, social impact, community support, natural culturing process, specialty coffee awards, specialty coffee, coffee partnership, d2c, coffee retail, farm ownership, coffee subscription, coffee roasting, coffee culture, farm-to-cup, b2c, retail, micro-dosing caffeine, award-winning coffee, environmental sustainability, high-quality coffee, coffee shop, services, coffee fermentation science, manufacturing, distribution, consumer products & retail, food & beverages, consumer goods, consumers, consumer internet, internet, information technology & services, mechanical or industrial engineering",http://www.linkedin.com/in/adam-paronto-9567516a,https://repriseroasters.com,http://www.linkedin.com/company/reprise-coffee-roasters,https://www.facebook.com/reprisecoffee,"",Chicago,Illinois,United States,"710 Main St, Evanston, Illinois, United States, 60202-1702",Evanston,Illinois,United States,'+1 773-942-6230,"Gmail, Google Apps, Microsoft Office 365, Amazon AWS, Mobile Friendly, Google Tag Manager, Squarespace ECommerce, Remote, Android, Circle, Toast, IoT, AI, Node.js","","","","","","","","",false,false,false,false,"",2099,31192,6a490bb6fe02c5001cfdcbc1,6a490bb6fe02c5001cfdcbc3,6a490bb6fe02c5001cfdcbc1,aparonto@yahoo.com,Apollo,Verified,Apollo,"","","","",""
Carmen,Turner,"Buyer- Hardgoods, Home Decor, Seasonal",PersonalizationMall.com,PersonalizationMall.com,carment@pmall.com,Verified,Apollo,Apollo,"",Not Catch-all,2026-06-24T11:16:08+00:00,Entry,Finance,Sourcing / Procurement,mike410123024@gmail.com,"","","",'+1 630-910-6000,"",false,Cold,"","",mike410123024@gmail.com,210,retail,"corporate gifts, personalized gifts, wedding gifts, christmas gifts, photo gifts, baby gifts, engraved gifts, ai gift design, video gifts, home decor, event gifts, audio gifts, personalization services, gift products, photo canvas prints, custom gifts, custom kitchenware, holiday gifts, giftware, photo books, gift sets, ai-designed gifts, jewelry, d2c, custom treat bags, seasonal gifts, services, monogramming, photo printing, special occasion gifts, personalized home decor, photo and video gifts, custom ornaments, custom jewelry, kitchenware, b2c, e-commerce, customization technology, personalized apparel, retail, occasion-specific gifts, personalized holiday cards, b2b, consumer products & retail, consumer internet, consumers, internet, information technology & services, flowers & gifts, gift shops, shopping",http://www.linkedin.com/in/carmen-turner-ba78128,https://personalizationmall.com,http://www.linkedin.com/company/personalizationmall-com,https://www.facebook.com/personalizationmall,https://twitter.com/personaluniv,Chicago,Illinois,United States,"51 Shore Drive, Burr Ridge, Illinois, United States, 60527",Burr Ridge,Illinois,United States,'+1 630-910-6000,"Google Search Console, Fastly CDN, CSC Corporate Domains, Valimail, Microsoft Exchange Online, Outlook, Microsoft 365, Microsoft 365 Apps & Services, Microsoft Exchange, Office365, CSC, Microsoft Office 365, Microsoft Email Providers, Fastly Hosting, Google Search Central, OpenAI, Google Trusted Stores, Datadog APM, Bugsnag, Google Analytics Ecommerce Tracking, Datadog Real User Monitoring, Adobe Fonts, Google Ads Remarketing, Wordpress, Google AdSense, reCAPTCHA, Google Tag Manager, Google Ads Conversion, Yoast, Mobile Friendly, Insight Hub (formally SmartBear's BugSnag tool), Google Font API, Google Dynamic Remarketing, Attentive, WordPress.org, DoubleClick Conversion, Viewport Meta, Blazor, Google AdWords Conversion, Bing Ads, Apache, Bing Webmaster Tools, Microsoft Clarity, Datadog, Typekit, Microsoft.net, jQuery, ASP.NET, Amazon CloudFront, Google Remarketing, TrustArc, Android, Circle, Remote, AI, Oracle Analytics Cloud, WMS, ADP StandOut, Rise, ADP, ADP SmartCompliance®, Postpresso, Gem, ARES, SAP, Snowflake, Rust, Salesforce, Altair Radioss, Atlas, Loom, Centric PLM, Microsoft Office, Cloudsuite WMS, Wavefront, IBM SPSS Modeler, Wider Planet, SAP Material Requirement Planning (MRP), 24-7 Media, Thomson Reuters Westlaw, Kaseya VSA, Qualtrics, Sprinklr, Sigma, Power BI Documenter, AppDynamics, Delivr, Flow, Acquia DAM (Widen), POINT, Tableau, PowerBI Tiles, Looker, Amazon Associates, DoorDash, Walmart Shopify Integration, GAS, Argo, GFI, Dell iDRAC (Integrated Dell Remote Access Controller), Microsoft PowerPoint, Microsoft Excel, Etracker, TikTok, Instagram, Pinterest, ICP, Balance, Bloom, .GIS, Certify, APC, Microsoft Project, Quip, SAP Customer Care and Service (CCS), AccessTrade",37700000,442000000,Merger / Acquisition,252000000,2020-02-01T00:00:00+00:00,"1-800-FLOWERS.COM, INC. (1800flowersinc.com)","1-800-FLOWERS.COM, INC. (1800flowersinc.com)","",false,false,false,false,1,"2732, 5961",454110,6a490bc50ea38500201b41a2,6a490bbaefc63b0010f9b4de,6a490bc50ea38500201b41a2,carmbo114@gmail.com,Apollo,Verified,Apollo,"","","","",""
Alex,Behrens,Owner,Maple Leaf Coffee Roasters,Maple Leaf Coffee Roasters,coffee@mapleleafroasters.com,Verified,Apollo,Apollo,"",Not Catch-all,2026-06-22T19:05:52+00:00,Owner,"","",mike410123024@gmail.com,"","","",'+1 630-974-7189,"",false,Cold,"","",mike410123024@gmail.com,2,food & beverages,"food & beverage services, small batch roasting, seasonal coffee blends, coffee shop supply, custom coffee blends, coffee club membership, coffee cupping, coffee subscriptions, cold brew coffee, local business support, b2c, coffee shop, specialty coffee, wholesale coffee, coffee and tea combo, coffee community, coffee for wholesale programs, retail coffee, coffee delivery, coffee education, coffee blends, artisan coffee roaster, specialty food and beverage, single origin coffee, b2b, tea selection, coffee and tea retail, e-commerce, local coffee shop, coffee and tea manufacturing, coffee roasting, d2c, coffee from multiple origins, tea retail, coffee equipment tips, illinoismade, coffee sourcing, coffee tasting, small batch coffee, retail, coffee tasting notes, education, manufacturing, distribution, consumer products & retail, food & beverages, consumer goods, consumers, consumer internet, internet, information technology & services, mechanical or industrial engineering",http://www.linkedin.com/in/alexbehrens,https://mapleleafroasters.com,http://www.linkedin.com/company/mapleleafroasters,"","",Chicago,Illinois,United States,"352 E Irving Park Rd, Roselle, Illinois, United States, 60172",Roselle,Illinois,United States,'+1 630-974-7189,"Gmail, Google Apps, Mobile Friendly, YouTube, Typekit, Google Tag Manager, Shopify, Circle","","","","","","","","",false,false,false,false,"",2099,31192,6a490bb5a1ee380020ecc3fb,6a490bb5a1ee380020ecc3fd,6a490bb5a1ee380020ecc3fb,abehrens@gmail.com,Apollo,Verified,Apollo,"","","","",""
Shea,Vanderwall,Assistant Buyer,Hot Rags,Hot Rags,shea@hotrags.com,Verified,Apollo,Apollo,"","",2026-06-10T09:00:00+00:00,Entry,Finance,Sourcing / Procurement,mike410123024@gmail.com,"","","",'+1 708-425-2129,"",false,Cold,"","",mike410123024@gmail.com,23,retail,"weed and cannabis merchandise, unique gifts, flags, socks, novelty gifts, seasonal merchandise, body jewelry, gifts for her, punk and goth fashion, pride flags, seasonal decor, funny gifts, small business support, clothing, sex toys, b2c, jewelry and accessories, home decor, gifts for mom and dad, online shop, candles, posters, pop culture merchandise, homegoods, home goods, crystals, jewelry accessories, drinkware, fair trade products, incense, lip balms, festival merch, games, plush toys, e-commerce, fashion accessories, novelty products, vegan products, handbags, air fresheners, d2c, halloween and horror decor, apparel, clothing and apparel, accessories, aromas, incense burners, pop culture collectibles, wood signs, jewelry, tapestries, music band merchandise, sassy and snarky gifts, gift shop, kitchenware, sassy socks, retail, gifts for him, small business, consumer internet, consumers, internet, information technology & services, fashion, men's clothing, shopping, women's clothing",http://www.linkedin.com/in/shea-vanderwall-84718993,https://hotrags.com,http://www.linkedin.com/company/hot-rags,https://facebook.com/hotrags,https://twitter.com/hot_rags,Chicago,Illinois,United States,"999 N Elmhurst Rd, Mount Prospect, Illinois, United States, 60056-1133",Mount Prospect,Illinois,United States,'+1 708-425-2129,"SendInBlue, Outlook, Shopify Product Reviews, Google Analytics, Mobile Friendly, Bing Ads, Shopify, Google Tag Manager",5066000,"","","","","","","",false,false,false,false,6,5999,"",6a490bc39d6aac001065286f,6a490bc39d6aac0010652871,6a490bc39d6aac001065286f,"","","","","","","","",""
Raoul,Adwan,Owner,thrd coffee,thrd coffee,raouladwan@thrdcoffee.com,Verified,Apollo,Apollo,"",Not Catch-all,2026-06-22T11:23:46+00:00,Owner,"","",mike410123024@gmail.com,"","","","","",false,Cold,"","",mike410123024@gmail.com,6,food & beverages,"hospitality, coffee for residential buildings, coffee cart service, coffee, coffee cart, mobile coffee, long-term barista service, specialty coffee, mobile espresso bar, d2c, coffee for private functions, pop-up bar, coffee events, food and beverage services, coffee business growth, coffee for offices, coffee experience, coffee branding customization, b2b, specialty coffee shops, chicago coffee, coffee catering, coffee in chicago, coffee atmosphere, coffee partnership, coffee branding, coffee industry, catering, coffee culture, coffee service program, barista concierge, events, coffee service, coffee for events, coffee amenity programs, mobile espresso solutions, catering and event planning, community-driven coffee, restaurants and other eating places, b2c, coffee for non-profits, coffee shop, retail, coffee equipment leasing, private event coffee, coffee for community events, coffee innovation, services, corporate coffee solutions, non-profit, consumer_products_retail, leisure, travel & tourism, food & beverage services, food & beverages, consumer goods, consumers, nonprofit organization management",http://www.linkedin.com/in/raoul-adwan,https://thrdcoffee.com,http://www.linkedin.com/company/thrd-coffee-company-llc,"","",Chicago,Illinois,United States,"1816 N Milwaukee Ave, Chicago, Illinois, United States, 60647-4411",Chicago,Illinois,United States,"","Gmail, Google Apps, Google Cloud Hosting","","","","","","","","",false,false,false,false,"",5812,"722320, 722330, 722515",6a490bc30ea38500201b418b,6a490bc30ea38500201b418c,6a490bc30ea38500201b418b,"","","","","","","","",""
Sean,Warner,Owner / Green Coffee Sales,Honduran Coffee Alliance,Honduran Coffee Alliance,sean@hondurancoffeealliance.com,Verified,Apollo,Apollo,"",Not Catch-all,2026-06-05T23:45:22+00:00,Owner,Sales,Sales,mike410123024@gmail.com,"","","",'+1 630-534-0968,"",false,Cold,"","",mike410123024@gmail.com,3,import & export,"specialty coffee, honduran green coffee, green coffee, green coffee importer, honduran specialty green coffee, relationship coffee, relationship specialty coffee, honduran specialty coffee, wholesale import & export, international trade & development",http://www.linkedin.com/in/sean-warner-3aba28108,https://hondurancoffeealliance.com,http://www.linkedin.com/company/honduran-coffee-alliance,"","",Hoffman Estates,Illinois,United States,"Chicago, Illinois, United States",Chicago,Illinois,United States,'+1 630-534-0968,"Micro, Remote","","","","","","","","",false,false,false,false,"","","",6a490be28bb57f0018942b18,6a490be28bb57f0018942b1a,6a490be28bb57f0018942b18,"","","","","","","","",""
Brad,Boza,Category Manager,Keurig Dr Pepper Inc.,Keurig Dr Pepper,brad.boza@kdrp.com,Verified,Apollo,Apollo,"",Not Catch-all,2026-06-23T17:03:47+00:00,Manager,"Marketing, Sales","",mike410123024@gmail.com,"","","","","",false,Cold,"","",mike410123024@gmail.com,29000,food & beverages,"beverages (production/distribution), consumer staples, food & beverage services, brand licensing, product innovation, environmental standards, beverage technology, beverage packaging, keurig brewing system, north american market, distribution channels, premium beverages, product portfolio, distribution & logistics, coffee products, b2c, market expansion, soft drinks, publicly traded, single-serve brewing, flavor innovation, brand portfolio, coffee, k-cup innovation, specialty coffee, beverage industry, sustainability, brand awareness, consumer health, energy drinks, retail, soft drink and ice manufacturing, beverage manufacturing, product formulation, sustainability initiatives, retail distribution, on-the-go beverages, innovation, keurig single-serve system, e-commerce, b2b, supply chain, beverage categories, food and beverage retail, consumer goods, market presence, customer engagement, merger and acquisition, product customization, non-carbonated beverages, carbonated drinks, beverage sustainability, water, employee benefits, consumer products, product development, ready-to-drink beverages, k-cup pods, product diversification, hot and cold beverages, beverage company, tea, mixers, distribution capabilities, k-cup, recycling program, corporate responsibility, health and well-being, global consumer, diversity and inclusion, team culture, job opportunities, community impact, customer satisfaction, retail partnerships, wholesale distribution, consumer engagement, team building, empowerment, environmental sustainability, employee resources, caffeine beverages, refreshing drinks, beverage marketing, iconic brands, keurig systems, safety standards, quality control, manufacturing sites, mentorship programs, leadership opportunities, corporate governance, impactful stories, financial performance, community support, strategic growth, market leadership, consumer trends, manufacturing, distribution, consumer products & retail, transportation & logistics, food & beverages, consumers, environmental services, renewables & environment, food production, consumer internet, internet, information technology & services, food & beverage retail, natural resources, mechanical or industrial engineering",http://www.linkedin.com/in/bradboza,https://keurigdrpepper.com,http://www.linkedin.com/company/keurig-dr-pepper-inc,https://facebook.com/DrPepper,https://twitter.com/drpepper,Chicago,Illinois,United States,"53 South Avenue, Burlington, Massachusetts, United States, 01803",Burlington,Massachusetts,United States,"","Apple Business Manager, AWS Cloud, Amazon CloudFront, AWS Public Cloud, Amazon Route 53, UltraDns, Apple School Manager, Microsoft Email Providers, Microsoft Exchange Online, Outlook, Microsoft 365, Microsoft 365 Apps & Services, Microsoft Exchange, Office365, Amazon AWS, NeuStar, Microsoft Office 365, Proofpoint, Proofpoint Email Security and Protection, Akamai CDN Solutions, Akamai, Akamai Web Application & API Protector, Amazon AWS, Amazon Route 53, Salesforce, Cloudflare DNS, Rackspace Email, CloudFlare Hosting, Pantheon, The Trade Desk, iCIMS, Slack, Netlify, Amazon SES, Salesforce Service Cloud, Salesforce Live Agent, Bluekai, Google Analytics 4 (GA4), Wordpress, Google Analytics, Tealium, Akamai App & API Protector, LinkedIn Ads, PrimeNG, Google Search Console, Linkedin Marketing Solutions, Viewport Meta, Oracle Visual Builder Cloud Service, Google Search Central, Boomerang JS library, HREF Lang, Bootstrapcdn, WordPress.org, Tealium iQ Tag Management, Google Tag Manager, SOASTA, Tealium Customer Data Hub, Nginx, Bootstrap Framework, Mobile Friendly, Bootstrap Framework v3.1.1, Akamai mPulse, Tealium AudienceStream CDP, Remote, AI, Gusto, INAP, Microsoft Office, HireVue, PeopleSoft Sales, dbt, Snow, Snowflake, Databricks, Fivetran, Informatica Cloud Mass Ingestion, Azure Data Factory, Airflow, Git, MySQL, Python, Electron, PowerBI Tiles, SAP, Alteryx, DAX, BASE, Ning, IAPPS, Kronos, ADP, Oracle Siebel, Strategy (formerly MicroStrategy), Cognos TM1, Appier AIRIS (formerly Woopra), Activa, Apache Spark, Delta Lake, OpenAI, Excel4Apps, Revel iPad POS, Apple iPhone, TikTok, Instagram, Pinterest, YouTube, Facebook, ConnectWise Control, AVEVA InTouch HMI, Amazon Managed Streaming for Apache Kafka (Amazon MSK), Salesforce Einstein AI, Microsoft PowerPoint, MAX by AppLovin, SAP Ariba, Salesforce Commerce Cloud, ServiceNow, Jabra Headsets And Speakerphones, Gem, Percipio, Act!, HPLC, ArtiosCAD, Microsoft Sharepoint, Olo, Postpresso, eMaint CMMS, Siemens SIMATIC HMI (Human Machine Interface), AC500 PLC, SS&C, AMP, LEAP, Workday, Kainos, Beeline, Microsoft Excel, Tor, Apple OS X Yosemite, Box, eBay, SAP ECC, IBM DataPower Gateway, AutoCAD, Dassault SOLIDWORKS, SAP Customer Care and Service (CCS), , SAP NetWeaver, SAP HANA, Oracle Fusion Middleware, Google Cloud APIs, Microsoft PowerShell, Jira, Atlassian Confluence, FactoryTalk, Coralogix, Glassbox, SMART Board, Route, Star, CAT, Nielsen Ad Intel, BMC Helix Discovery, Shopp, JDA, Idera SQL Diagnostic Manager, Perfecto, Google AdWords Conversion, Salesforce CRM Analytics, Veeam ONE, mabl, Motorola, Freelance Distributed Control System (DCS), Inventor, Planview LeanKit, ABB Distributed Control Systems (DCS), Khoros for SAP Customer Experience Cloud, Mulesoft, Archibus, Mode, LOU, Concur, Copilot, Microsoft Power Automate, Microsoft Power Platform, Excel Impact, POINT, Zipteams, IBM Cognos Analytics, Oracle XML DB, Docebo, Yahoo Ad Manager, Micro, AWS Application Load Balancer, FIS, Visio, VMware View Manager, YieldBot, SAP Data Maintenance for ERP by Vistex, Yandex Metrica, WMS, SAP Material Requirement Planning (MRP), TrackWise, Apple iPad, .GIS, Homestead, Veeam, Power BI Documenter, SAP ERP, Automic Automation, CNC Software, GRIN, Glide, FRAC Pumps, Liquid, Quip, Workvivo, Informatica, SEEBURGER Business Integration Suite, GoToAssist, Delta Sharing, AWS Transfer for SFTP, blend, SteamVR, Truckstop Load Board, Cash App, OpenProject, Microsoft Teams, AVEVA PDMS, IQMS, ETQ Reliance QMS, Agile GCP Labs, Oracle GRC, GoToAssist, Eightfold AI, Tableau, Nielsen NetRatings, 24-7 Media, Sigma, Microsoft AdCenter, AWS Database Migration Service, Shopify, .NET, ICE, Westlaw, Microsoft Word, Microsoft Project, Microsoft Power Apps, Thomson Reuters Westlaw, Google Cloud BigQuery, Azure Synapse, WebAwesome",16603000000,"","","","",JAB HOLDING COMPANY LLC (jabholco.com),JAB HOLDING COMPANY LLC (jabholco.com),"",false,false,false,false,"","2086, 2095, 3634","311920, 312111, 335210",6a490bb767660800207fadda,6a490bb767660800207faddb,6a490bb767660800207fadda,bboza@yahoo.com,Apollo,Verified,Apollo,"","","","",""
Kaley,Sheldon,Category Manager,"American Metalcraft, Inc.",American Metalcraft,ksheldon@amnow.com,Verified,Apollo,Apollo,"","",2026-06-03T07:21:39+00:00,Manager,"Marketing, Sales","",mike410123024@gmail.com,"","","",'+1 800-333-9133,"",false,Cold,"","",mike410123024@gmail.com,51,business supplies & equipment,"tabletop & buffet supplies, bar supplies, pizza trays, kitchen supplies, pizza trays pizza supplies plate covers tabletop & buffet supplies bar supplies kitchen supplies, plate covers, pizza supplies, food presentation domes, buffet accessories, retail, restaurant display items, food safety, food paper and cups, buffet display solutions, foodservice equipment, restaurant equipment, buffet and display, food display risers, buffet display tools, melamine dinnerware, food storage containers, buffet display, buffet display items, food presentation tools, buffet display risers, buffet display trays, restaurant equipment & supplies, food safety dispensers, glassware, restaurant buffet accessories, buffet warmers, foodservice products, buffetware, bar tools and accessories, food presentation accessories, food presentation equipment, kitchenware & cookware, food presentation & display, restaurant products, b2b, catering supplies, tableware, kitchen utensils, food containers, buffet & display equipment, restaurant accessories, buffet and catering supplies, e-commerce, enamelware, restaurant tableware, food presentation, buffet and display accessories, stainless steel cookware, restaurant signage, home furnishing merchant wholesalers, dinnerware, buffet display accessories, restaurant tableware sets, buffet display equipment, buffet trays, pizza pans, food presentation solutions, restaurant display equipment, bar tools, buffet risers, buffet and display equipment, food display stands, kitchen tools, tabletop accessories, restaurant display stands, food safety products, foodservice supplies, restaurant supplies, restaurant displayware, foodservice equipment & supplies, distribution, consumer products & retail, consumer internet, consumers, internet, information technology & services",http://www.linkedin.com/in/kaley-sheldon-aaa2924b,https://amnow.com,http://www.linkedin.com/company/american-metalcraft-inc-,https://facebook.com/americanmetalcraft,https://twitter.com/AmerMetalcraft,Chicago,Illinois,United States,"3708 North River Road, Franklin Park, Illinois, United States, 60131",Franklin Park,Illinois,United States,'+1 800-333-9133,"EasyDNS, Amazon SES, Outlook, MailChimp SPF, Microsoft Office 365, Zendesk, Hubspot, reCAPTCHA, Mobile Friendly, Nginx, Typekit, Google Maps (Non Paid Users), Woo Commerce, Bootstrap Framework, ShareThis, Google Maps, Gravity Forms, WordPress.org, Remote",5397000,"","","","","","","",false,false,false,false,"",3999,"42322, 332215",6a490bbb50a14900100e3fc6,6a490bbb50a14900100e3fc8,6a490bbb50a14900100e3fc6,kaleytsheldon@gmail.com,Apollo,Verified,Apollo,"","","","",""
