First Name,Last Name,Title,Company Name,Company Name for Emails,Email,Email Status,Primary Email Source,Primary Email Verification Source,Email Confidence,Primary Email Catch-all Status,Primary Email Last Verified At,Seniority,Departments,Sub Departments,Contact Owner,Work Direct Phone,Home Phone,Mobile Phone,Corporate Phone,Other Phone,Do Not Call,Stage,Lists,Last Contacted,Account Owner,# Employees,Industry,Keywords,Person Linkedin Url,Website,Company Linkedin Url,Facebook Url,Twitter Url,City,State,Country,Company Address,Company City,Company State,Company Country,Company Phone,Technologies,Annual Revenue,Total Funding,Latest Funding,Latest Funding Amount,Last Raised At,Subsidiary of,Subsidiary of (Organization ID),Email Sent,Email Open,Email Bounced,Replied,Demoed,Number of Retail Locations,SIC Codes,NAICS Codes,Apollo Contact Id,Apollo Account Id,Apollo Record Id,Secondary Email,Secondary Email Source,Secondary Email Status,Secondary Email Verification Source,Tertiary Email,Tertiary Email Source,Tertiary Email Status,Tertiary Email Verification Source,Qualify Contact
Michelle,Bank,Associate Category Manager,"American Metalcraft, Inc.",American Metalcraft,mbank@amnow.com,Verified,Apollo,Apollo,"","",2026-05-30T15:02:56+00:00,Manager,Marketing,Product Marketing,mike410123024@gmail.com,"","","",'+1 800-333-9133,"",false,Cold,"","",mike410123024@gmail.com,51,business supplies & equipment,"tabletop & buffet supplies, bar supplies, pizza trays, kitchen supplies, pizza trays pizza supplies plate covers tabletop & buffet supplies bar supplies kitchen supplies, plate covers, pizza supplies, food presentation domes, buffet accessories, retail, restaurant display items, food safety, food paper and cups, buffet display solutions, foodservice equipment, restaurant equipment, buffet and display, food display risers, buffet display tools, melamine dinnerware, food storage containers, buffet display, buffet display items, food presentation tools, buffet display risers, buffet display trays, restaurant equipment & supplies, food safety dispensers, glassware, restaurant buffet accessories, buffet warmers, foodservice products, buffetware, bar tools and accessories, food presentation accessories, food presentation equipment, kitchenware & cookware, food presentation & display, restaurant products, b2b, catering supplies, tableware, kitchen utensils, food containers, buffet & display equipment, restaurant accessories, buffet and catering supplies, e-commerce, enamelware, restaurant tableware, food presentation, buffet and display accessories, stainless steel cookware, restaurant signage, home furnishing merchant wholesalers, dinnerware, buffet display accessories, restaurant tableware sets, buffet display equipment, buffet trays, pizza pans, food presentation solutions, restaurant display equipment, bar tools, buffet risers, buffet and display equipment, food display stands, kitchen tools, tabletop accessories, restaurant display stands, food safety products, foodservice supplies, restaurant supplies, restaurant displayware, foodservice equipment & supplies, distribution, consumer products & retail, consumer internet, consumers, internet, information technology & services",http://www.linkedin.com/in/michellefbank,https://amnow.com,http://www.linkedin.com/company/american-metalcraft-inc-,https://facebook.com/americanmetalcraft,https://twitter.com/AmerMetalcraft,Chicago,Illinois,United States,"3708 North River Road, Franklin Park, Illinois, United States, 60131",Franklin Park,Illinois,United States,'+1 800-333-9133,"EasyDNS, Amazon SES, Outlook, MailChimp SPF, Microsoft Office 365, Zendesk, Hubspot, reCAPTCHA, Mobile Friendly, Nginx, Typekit, Google Maps (Non Paid Users), Woo Commerce, Bootstrap Framework, ShareThis, Google Maps, Gravity Forms, WordPress.org, Remote",5397000,"","","","","","","",false,false,false,false,"",3999,"42322, 332215",6a490bc16a6d9f0020314f0b,6a490bbb50a14900100e3fc8,6a490bc16a6d9f0020314f0b,"","","","","","","","",""
Corinne,Sayers,"VP, Sr. Category Manager",Lifetime Brands,Lifetime Brands,corinne.sayers@lifetimebrands.com,Verified,Apollo,Apollo,"",Catch-all,2026-06-08T15:22:49+00:00,Vp,"","",mike410123024@gmail.com,"","","",'+1 516-683-6000,"",false,Cold,"","",mike410123024@gmail.com,1200,consumer goods,"home decor, tabletop, food preparation, industrial machinery/components, consumer discretionary, b2c, branded consumer products, eco-conscious product options, d2c, home decor accessories, premium product lines, product design, home improvement, home products, e-commerce, retail, tableware, exclusive product lines, limited edition collections, designer dinnerware, trend-based product launches, consumer preferences, seasonal product offerings, private label products, product customization, market expansion, brand licensing agreements, consumer durables, consumer trend adaptation, trend-right designs, eco-friendly materials, product assortment, kitchenware, brand portfolio, brand recognition, online retail, bakeware, innovation, global presence, b2b, marketing, innovative kitchen gadgets, value-tiered products, brand licensing, development, market reach, retail partnerships, brand management, product innovation, product quality, manufacturing, retail channel diversification, specialty kitchen tools, luxury homeware, specialty bakeware, design, product categories, licensed brands, flatware, dinnerware, premium cookware, sporting and athletic goods manufacturing, retail distribution, cookware, consumer goods, retail channels, product development, sustainability, brand collaborations, customer engagement, product safety standards, market-specific product lines, gourmet kitchen tools, trend-driven product design, collaborative product lines, cutlery, kitchen tools, gadgets, barware, kitchen gadgets, spices, home décor, giftware, stylish design, functional products, event hosting, kitchen essentials, brand marketing, private label, sustainable packaging, community outreach, food storage, environmental solutions, consumer safety, creative design, kitchen organization, table setting, portable beverageware, wine tools, non-stick bakeware, cooking utensils, cookbook accessories, holiday dining, custom designs, culinary solutions, culinary gadgets, high-quality materials, trend-right products, global distribution, eco-friendly, exclusive brands, cooking accessories, chef tools, gourmet kitchenware, distribution, consumer products & retail, consumer internet, consumers, internet, information technology & services, mechanical or industrial engineering, environmental services, renewables & environment, marketing & advertising, enterprise software, enterprises, computer software",http://www.linkedin.com/in/corinnesayers,https://lifetimebrands.com,http://www.linkedin.com/company/lifetime-brands,https://facebook.com/lifetimebrands/,https://twitter.com/lifetimebrands,Naperville,Illinois,United States,"1000 Stewart Avenue, Garden City, New York, United States, 11530",Garden City,New York,United States,'+1 516-683-6000,"Google Search Central, Google Search Console, Google Workspace, DNS Made Easy, Shopify, Mailgun, Rackspace MailGun, Sendgrid, Twilio SendGrid Email API, Twilio SendGrid Email Marketing Campaigns, Gmail, Google Meet, Google Apps, GoDaddy Domains, GoDaddy Hosting, Amazon AWS, Microsoft Office 365, VueJS, WP Engine, Atlassian Cloud, Shopify Plus, Slack, Shopify Product Reviews, TrustArc, Elementor, Viewport Meta, Mobile Friendly, YouTube, Remote, Android, Node.js, AI, OneTrust Tech Risk & Compliance, Adobe Creative Suite, Adobe InDesign, Google, RoboHead, Dassault SOLIDWORKS, Slaask, WMS, Capture One Pro, Adobe Photoshop, Apple macOS, Excel4Apps, AT&T, ESET, Quip, Sass, ScreenCloud Digital Signage, Security, Epic, Meta Ads Manager, Cint, SAP Billing and Revenue Innovation Management, Microsoft Excel, Gem, Asana, Wider Planet, TikTok, Yotpo, Google Analytics, SAP, Concur, Microsoft Office",647933000,"","","","","","","",false,false,false,false,"",3631,"33992, 31-33, 42, 44-45",6a490bc4a1ee380020ecc480,6a490bc4a1ee380020ecc482,6a490bc4a1ee380020ecc480,cgorskey@gmail.com,Apollo,Verified,Apollo,"","","","",""
Jeff,Dreyfuss,Owner,Metropolis Coffee Company,Metropolis Coffee Company,jeff@metropoliscoffee.com,Verified,Apollo,Apollo,"",Not Catch-all,2026-06-08T18:24:14+00:00,Owner,"","",mike410123024@gmail.com,"","","",'+1 773-764-0400,"",false,Cold,"","",mike410123024@gmail.com,55,food & beverages,"roasterie, coffee distribution, coffee service, coffee shops, wholesale coffee, grocery coffee, online ecommerce, coffee sourcing, coffee roaster, organic coffee, specialty coffee, great coffee, lgbt, roastery, coffee equipment, coffee and tea manufacturing, delivery, local snacks and merchandise, coffee gear, coffee, cold brew system, coffee community, coffee accessories, retail coffee, coffee for home brewing, cold brew, coffee gift boxes, custom coffee blends, b2c, nitrogen flushed coffee, hand roasted coffee, coffee wholesale program, coffee blends, premium coffee packaging, food and beverage retail, customer service, foodservice and hospitality, coffee tasting, single origin coffee, coffee for cafes and restaurants, coffee subscription service, apparel, coffee brewing gear, freshly roasted beans, cafe, science fiction inspired branding, coffee education and quiz, coffee shop, coffee subscription, award-winning roaster, wholesale food distribution, e-commerce, organic, coffee shop chicago, sustainability in coffee, wholesale, coffee roasting and retail, e-commerce retail, d2c, b2b, coffee capsules, chicago coffee roaster, chicago’s most essential café, coffee merchandise, fair trade coffee, specialty coffee awards, manufacturing, distribution, consumer products & retail, transportation & logistics, retail, food & beverage retail, food & beverages, consumer goods, consumers, consumer internet, internet, information technology & services, mechanical or industrial engineering, coffee & tea, food",http://www.linkedin.com/in/jeff-dreyfuss-4a55794b,https://metropoliscoffee.com,http://www.linkedin.com/company/metropolis-coffee-company,https://facebook.com/metropoliscoffee,https://twitter.com/mtropoliscoffee,Chicago,Illinois,United States,"3057 N Rockwell St, Chicago, Illinois, United States, 60618",Chicago,Illinois,United States,'+1 773-764-0400,"Cloudflare DNS, Mailchimp Mandrill, Gmail, Google Apps, Google Cloud Hosting, Drupal, UPS, Gorgias, Slack, Recharge Payments, Shopify Plus, Android, Remote, AI, YouTube, Linkedin Marketing Solutions",5313000,"","","","","","","",false,false,false,false,"",2099,"311920, 722515",6a490bb12695fc0014b951a9,6a490bb12695fc0014b951ab,6a490bb12695fc0014b951a9,"","","","","","","","",""
Robert,Quinlan,President,Dark Matter Coffee,Dark Matter Coffee,bob@darkmattercoffee.com,Verified,Apollo,Apollo,"",Not Catch-all,2026-06-10T06:50:27+00:00,Vp,"","",mike410123024@gmail.com,"","","",'+1 773-360-7553,"",false,Cold,"","",mike410123024@gmail.com,36,food & beverages,"food & beverage services, art and music events, creative branding in coffee, creative coffee culture, community engagement, consumer goods, cosmic philosophy in coffee, art and music collaborations, coffee sourcing, coffee as cultural expression, limited edition releases, art and music inspired merchandise, music and art projects, art and music integration, artistic packaging design, coffee from el salvador and guatemala, d2c, coffee collaborations, innovative roasting techniques, artistic expression, chicago coffee roaster, innovative coffee processing, beverages, community-driven, community partnerships, collaborative projects, coffee from central america, cosmic and philosophical branding, artistic expression in packaging, coffee subscription service, artistic and musical branding, community-driven coffee culture, art and music projects in coffee, limited edition coffee, specialty coffee from central america, art-inspired packaging, cosmic and artistic coffee branding, specialty coffee blends, artistic packaging, coffee subscriptions, coffee and tea manufacturing, specialty coffee, art-inspired merchandise, art and music fusion in coffee, artistic collaborations with musicians, limited releases, e-commerce, b2c, coffee roasting, direct trade coffee, art-inspired labels and packaging, limited edition coffee art, innovative roasting methods, retail, chocolate, arts, entertainment, and recreation, art-inspired labels, creative coffee branding, limited release coffee blends, cosmic coffee philosophy, manufacturing, consumer products & retail, b2b, food & beverages, consumers, consumer internet, internet, information technology & services, mechanical or industrial engineering, coffee & tea, food, local flavor",http://www.linkedin.com/in/robert-quinlan-14a2a79,https://darkmattercoffee.com,http://www.linkedin.com/company/dark-matter-coffee,https://facebook.com/DarkMatterCoffee,https://twitter.com/darkmatter2521,Chicago,Illinois,United States,"738 N Western Ave, Chicago, Illinois, United States, 60612",Chicago,Illinois,United States,'+1 773-360-7553,"Google Search Central, Google Search Console, Google Workspace, GoDaddy Domains, Gmail, Google Meet, GoDaddy Hosting, Google Apps, Shopify Unlimited, Shopify Plus, Slack, Shopify Custom, Google Tag Manager, Viewport Meta, Shopify Developer Platform, Klaviyo, Shopify, reCAPTCHA, Mobile Friendly, Remote, Google Sheets, Postpresso",4919000,"","","","","","","",false,false,false,false,3,"2099, 2095, 5812","311920, 722515",6a490bdfa1ee380020ecc568,6a490bdfa1ee380020ecc56a,6a490bdfa1ee380020ecc568,"","","","","","","","",""
J,Mlodzinski,Green Coffee Logistics Manager / Green Coffee Buyer,Intelligentsia Coffee Inc.,Intelligentsia Coffee,jmlodzinski@intelligentsiacoffee.com,Verified,Apollo,Apollo,"",Catch-all,2026-06-15T13:05:13+00:00,Manager,"Finance, Operations","Sourcing / Procurement, Logistics",mike410123024@gmail.com,"","","",'+1 773-348-8058,"",false,Cold,"","",mike410123024@gmail.com,210,food & beverages,"high quality coffee service, coffee distribution, specialty coffee, coffee sourcing, wholesale coffee, coffee shops, direct trade, online ecommerce, grocery coffee, food & beverage services, coffee sustainability, coffee, coffee farmer relationships, coffee education, third-wave coffee, vintage gas roasters, sustainable coffee, coffee technology, e-commerce, coffee from ethiopia, coffee quality, coffee and tea manufacturing, b2c, coffee from east africa, high-quality beans, coffee cafes, direct trade coffee, customer experience, d2c, coffee farmers, coffee production, customer engagement, coffee from central america, b2b, coffee retail, coffee sustainability practices, coffee wholesale, coffee quality control, sustainability, vintage roasters, retail, coffee roasting, coffee innovation, coffee experience, coffee industry innovation, services, coffee culture, roasting techniques, coffee shop, food service and drinking places, coffee community, food and beverage retail, coffee supply chain, coffee beans, sustainable sourcing, wholesale trade, handcrafted roasters, roasted coffee, subscriptions, free shipping, personalized recommendations, coffee blends, espresso, fresh coffee, coffee quiz, coffee delivery, gift options, quality control, customer support, gift cards, coffee brewing equipment, seasonal coffee, exclusive offers, broad flavor profiles, coffee tasting, hand-picked coffee, curated coffee, discount codes, sustainable practices, coffee variety, online coffee store, order history, mobile-friendly, order management, coffee bundles, coffee promotions, organic coffee, coffee trivia, employee gifts, loyalty rewards, coffee subscriptions, coffee aficionados, best-selling coffees, artisan coffee, custom blends, coffee quality assurance, local coffee, international coffee farming, specialty_coffee, direct_trade, third_wave, coffee_roasting, sustainable_sourcing, coffee_beans, coffee_culture, coffee_quality, coffee_supply_chain, coffee_education, coffee_shop, coffee_wholesale, coffee_distribution, coffee_technology, food & beverages, consumer goods, consumers, consumer internet, internet, information technology & services, environmental services, renewables & environment, food & beverage retail, coffee & tea, food",http://www.linkedin.com/in/j-mlodzinski-a2153586,https://intelligentsia.com,http://www.linkedin.com/company/intelligentsia-coffee-&-tea,https://www.facebook.com/IntelligentsiaCoffee/,https://twitter.com/intelligentsia,Chicago,Illinois,United States,"1850 West Fulton Street, Chicago, Illinois, United States, 60612",Chicago,Illinois,United States,'+1 773-348-8058,"Google Search Console, GoDaddy Domains, Gmail, Google Apps, NetSuite, Apple Business Manager, Apple School Manager, Shopify Plus, Slack, Typekit, reCAPTCHA, Mobile Friendly, SearchSpring, Shopify, Wufoo, Klaviyo, Hotjar, Google Tag Manager, Remote, Circle",20000000,"","","","","","","",false,false,false,false,14,2092,"311920, 722515",6a490bc72695fc0014b9524e,6a490bc72695fc0014b95250,6a490bc72695fc0014b9524e,"","","","","","","","",""
Jennifer,Harris,Buyer,PersonalizationMall.com,PersonalizationMall.com,jenniferk@pmall.com,Verified,Apollo,Apollo,"",Not Catch-all,2026-06-03T14:46:56+00:00,Entry,Finance,Sourcing / Procurement,mike410123024@gmail.com,"","","",'+1 630-910-6000,"",false,Cold,"","",mike410123024@gmail.com,210,retail,"corporate gifts, personalized gifts, wedding gifts, christmas gifts, photo gifts, baby gifts, engraved gifts, ai gift design, video gifts, home decor, event gifts, audio gifts, personalization services, gift products, photo canvas prints, custom gifts, custom kitchenware, holiday gifts, giftware, photo books, gift sets, ai-designed gifts, jewelry, d2c, custom treat bags, seasonal gifts, services, monogramming, photo printing, special occasion gifts, personalized home decor, photo and video gifts, custom ornaments, custom jewelry, kitchenware, b2c, e-commerce, customization technology, personalized apparel, retail, occasion-specific gifts, personalized holiday cards, b2b, consumer products & retail, consumer internet, consumers, internet, information technology & services, flowers & gifts, gift shops, shopping",http://www.linkedin.com/in/jennifer-harris-b497a51b,https://personalizationmall.com,http://www.linkedin.com/company/personalizationmall-com,https://www.facebook.com/personalizationmall,https://twitter.com/personaluniv,Chicago,Illinois,United States,"51 Shore Drive, Burr Ridge, Illinois, United States, 60527",Burr Ridge,Illinois,United States,'+1 630-910-6000,"Google Search Console, Fastly CDN, CSC Corporate Domains, Valimail, Microsoft Exchange Online, Outlook, Microsoft 365, Microsoft 365 Apps & Services, Microsoft Exchange, Office365, CSC, Microsoft Office 365, Microsoft Email Providers, Fastly Hosting, Google Search Central, OpenAI, Google Trusted Stores, Datadog APM, Bugsnag, Google Analytics Ecommerce Tracking, Datadog Real User Monitoring, Adobe Fonts, Google Ads Remarketing, Wordpress, Google AdSense, reCAPTCHA, Google Tag Manager, Google Ads Conversion, Yoast, Mobile Friendly, Insight Hub (formally SmartBear's BugSnag tool), Google Font API, Google Dynamic Remarketing, Attentive, WordPress.org, DoubleClick Conversion, Viewport Meta, Blazor, Google AdWords Conversion, Bing Ads, Apache, Bing Webmaster Tools, Microsoft Clarity, Datadog, Typekit, Microsoft.net, jQuery, ASP.NET, Amazon CloudFront, Google Remarketing, TrustArc, Android, Circle, Remote, AI, Oracle Analytics Cloud, WMS, ADP StandOut, Rise, ADP, ADP SmartCompliance®, Postpresso, Gem, ARES, SAP, Snowflake, Rust, Salesforce, Altair Radioss, Atlas, Loom, Centric PLM, Microsoft Office, Cloudsuite WMS, Wavefront, IBM SPSS Modeler, Wider Planet, SAP Material Requirement Planning (MRP), 24-7 Media, Thomson Reuters Westlaw, Kaseya VSA, Qualtrics, Sprinklr, Sigma, Power BI Documenter, AppDynamics, Delivr, Flow, Acquia DAM (Widen), POINT, Tableau, PowerBI Tiles, Looker, Amazon Associates, DoorDash, Walmart Shopify Integration, GAS, Argo, GFI, Dell iDRAC (Integrated Dell Remote Access Controller), Microsoft PowerPoint, Microsoft Excel, Etracker, TikTok, Instagram, Pinterest, ICP, Balance, Bloom, .GIS, Certify, APC, Microsoft Project, Quip, SAP Customer Care and Service (CCS), AccessTrade",37700000,442000000,Merger / Acquisition,252000000,2020-02-01T00:00:00+00:00,"1-800-FLOWERS.COM, INC. (1800flowersinc.com)","1-800-FLOWERS.COM, INC. (1800flowersinc.com)","",false,false,false,false,1,"2732, 5961",454110,6a490bbaefc63b0010f9b4dc,6a490bbaefc63b0010f9b4de,6a490bbaefc63b0010f9b4dc,jkink25@aol.com,Apollo,Verified,Apollo,"","","","",""
Jamie,Fonzo,Product Category Manager,Pampered Chef,Pampered Chef,jdifonzo@pamperedchef.com,Verified,Apollo,Apollo,"","",2026-06-19T18:37:50+00:00,Manager,Product,Product Management,mike410123024@gmail.com,"","","",'+1 888-687-2433,"",false,Cold,"","",mike410123024@gmail.com,9100,retail,"culinary, cooking, kitchen, ecommerce, recipes, direct sales, stressfree meals, customer engagement, food products, cooking education, digital tools, home cooking, specialty cookware, consumer goods, product innovation, international markets, cookbooks, retail, virtual demonstrations, b2c, independent consultants, community engagement, recipe sharing, community connection, cooking demonstrations, customer empowerment, kitchenware, social mealtime focus, home meal prep, community support, direct selling, entrepreneurial opportunities, online shopping, charity programs, food bank fundraising, product range, online ordering, entrepreneurship, community-driven, multi-level marketing, kitchen tools, kitchen gadgets, global expansion, food and beverage, digital engagement, charitable activities, digital ordering, mlm, e-commerce, education, consumer products & retail, d2c, consumer internet, consumers, internet, information technology & services, health, wellness & fitness, food & beverages, marketing & advertising",http://www.linkedin.com/in/jamie-di-fonzo-07414829,https://pamperedchef.com,http://www.linkedin.com/company/the-pampered-chef,https://facebook.com/PamperedChef/,https://twitter.com/pamperedchef,Chicago,Illinois,United States,"1 Pampered Chef Lane, Addison, Illinois, United States, 60101",Addison,Illinois,United States,'+1 888-687-2433,"Google Search Console, Apple Business Manager, Cloudflare DNS, Apple School Manager, Microsoft Exchange Online, Outlook, Microsoft 365, Microsoft 365 Apps & Services, Microsoft Exchange, Office365, Microsoft Office 365, Zendesk, CloudFlare Hosting, Google Search Central, CloudFlare CDN, Zendesk for Service, Oracle SPF, Microsoft Email Providers, Zendesk Support Suite, CloudFlare, Atlassian Cloud, React Redux, The Trade Desk, Slack, Acquia DAM (Widen), Contentful, Google Font API, Priority Hints, Algolia, Bing, Salesforce Marketing Cloud, PowerReviews, Cart Functionality, PWA, Cloudflare Insights, Mobile Friendly, Cloudflare Bot Management, Cloudflare Browser Insights, Tablesorter, Bing Webmaster Tools, Open Graph, jsDelivr, ExactTarget, Viewport Meta, Salesforce Email Studio, Font Awesome, Pinterest, Apple iOS, cdnjs, Google Tag Manager, Adobe Dreamweaver, Salesforce Journey Builder, jQuery, Osano, iGoDigital, Gem, Everest, ConnectWise Control, Angular, React, TypeScript, Next.js, Node.js, AWS SDK for JavaScript, Amazon Managed Streaming for Apache Kafka (Amazon MSK), AWS Analytics, Amazon EC2, Amazon S3, AWS CloudFormation, Lambda Cloud, Jenkins, Atlassian Bitbucket, Jira, dynaTrace, Snyk, Hybris (SAP), Google Analytics, Power BI Documenter, MySQL, Greenhouse, Atlassian Bitbucket, Salesforce, ACL, commercetools, Microsoft Azure Monitor, AWS Trusted Advisor, Apache Kafka, AWS WAF, Barracuda Spam Firewall",1400000000,"","","","",Berkshire Hathaway (berkshirehathaway.com),Berkshire Hathaway (berkshirehathaway.com),"",false,false,false,false,"",5999,44-45,6a490bc017d0950018c1c5cf,6a490bc017d0950018c1c5d1,6a490bc017d0950018c1c5cf,jamiedifonzo@aol.com,Apollo,Verified,Apollo,"","","","",""
