Meredith,Fay,Dropship Buyer,PersonalizationMall.com,PersonalizationMall.com,meredithf@pmall.com,Verified,Apollo,Apollo,"",Not Catch-all,2026-06-03T14:47:25+00:00,Entry,Finance,Sourcing / Procurement,mike410123024@gmail.com,"","","",'+1 630-910-6000,"",false,Cold,"","",mike410123024@gmail.com,210,retail,"corporate gifts, personalized gifts, wedding gifts, christmas gifts, photo gifts, baby gifts, engraved gifts, ai gift design, video gifts, home decor, event gifts, audio gifts, personalization services, gift products, photo canvas prints, custom gifts, custom kitchenware, holiday gifts, giftware, photo books, gift sets, ai-designed gifts, jewelry, d2c, custom treat bags, seasonal gifts, services, monogramming, photo printing, special occasion gifts, personalized home decor, photo and video gifts, custom ornaments, custom jewelry, kitchenware, b2c, e-commerce, customization technology, personalized apparel, retail, occasion-specific gifts, personalized holiday cards, b2b, consumer products & retail, consumer internet, consumers, internet, information technology & services, flowers & gifts, gift shops, shopping",http://www.linkedin.com/in/meredith-fay,https://personalizationmall.com,http://www.linkedin.com/company/personalizationmall-com,https://www.facebook.com/personalizationmall,https://twitter.com/personaluniv,Hoffman Estates,Illinois,United States,"51 Shore Drive, Burr Ridge, Illinois, United States, 60527",Burr Ridge,Illinois,United States,'+1 630-910-6000,"Google Search Console, Fastly CDN, CSC Corporate Domains, Valimail, Microsoft Exchange Online, Outlook, Microsoft 365, Microsoft 365 Apps & Services, Microsoft Exchange, Office365, CSC, Microsoft Office 365, Microsoft Email Providers, Fastly Hosting, Google Search Central, OpenAI, Google Trusted Stores, Datadog APM, Bugsnag, Google Analytics Ecommerce Tracking, Datadog Real User Monitoring, Adobe Fonts, Google Ads Remarketing, Wordpress, Google AdSense, reCAPTCHA, Google Tag Manager, Google Ads Conversion, Yoast, Mobile Friendly, Insight Hub (formally SmartBear's BugSnag tool), Google Font API, Google Dynamic Remarketing, Attentive, WordPress.org, DoubleClick Conversion, Viewport Meta, Blazor, Google AdWords Conversion, Bing Ads, Apache, Bing Webmaster Tools, Microsoft Clarity, Datadog, Typekit, Microsoft.net, jQuery, ASP.NET, Amazon CloudFront, Google Remarketing, TrustArc, Android, Circle, Remote, AI, Oracle Analytics Cloud, WMS, ADP StandOut, Rise, ADP, ADP SmartCompliance®, Postpresso, Gem, ARES, SAP, Snowflake, Rust, Salesforce, Altair Radioss, Atlas, Loom, Centric PLM, Microsoft Office, Cloudsuite WMS, Wavefront, IBM SPSS Modeler, Wider Planet, SAP Material Requirement Planning (MRP), 24-7 Media, Thomson Reuters Westlaw, Kaseya VSA, Qualtrics, Sprinklr, Sigma, Power BI Documenter, AppDynamics, Delivr, Flow, Acquia DAM (Widen), POINT, Tableau, PowerBI Tiles, Looker, Amazon Associates, DoorDash, Walmart Shopify Integration, GAS, Argo, GFI, Dell iDRAC (Integrated Dell Remote Access Controller), Microsoft PowerPoint, Microsoft Excel, Etracker, TikTok, Instagram, Pinterest, ICP, Balance, Bloom, .GIS, Certify, APC, Microsoft Project, Quip, SAP Customer Care and Service (CCS), AccessTrade",37700000,442000000,Merger / Acquisition,252000000,2020-02-01T00:00:00+00:00,"1-800-FLOWERS.COM, INC. (1800flowersinc.com)","1-800-FLOWERS.COM, INC. (1800flowersinc.com)","",false,false,false,false,1,"2732, 5961",454110,6a490bbc50a14900100e3fd1,6a490bbaefc63b0010f9b4de,6a490bbc50a14900100e3fd1,"","","","","","","","",""
Jackson,Hays,Buyer,"American Metalcraft, Inc.",American Metalcraft,jhays@amnow.com,Verified,Apollo,Apollo,"","",2026-06-03T07:21:38+00:00,Entry,Finance,Sourcing / Procurement,mike410123024@gmail.com,"","","",'+1 800-333-9133,"",false,Cold,"","",mike410123024@gmail.com,51,business supplies & equipment,"tabletop & buffet supplies, bar supplies, pizza trays, kitchen supplies, pizza trays pizza supplies plate covers tabletop & buffet supplies bar supplies kitchen supplies, plate covers, pizza supplies, food presentation domes, buffet accessories, retail, restaurant display items, food safety, food paper and cups, buffet display solutions, foodservice equipment, restaurant equipment, buffet and display, food display risers, buffet display tools, melamine dinnerware, food storage containers, buffet display, buffet display items, food presentation tools, buffet display risers, buffet display trays, restaurant equipment & supplies, food safety dispensers, glassware, restaurant buffet accessories, buffet warmers, foodservice products, buffetware, bar tools and accessories, food presentation accessories, food presentation equipment, kitchenware & cookware, food presentation & display, restaurant products, b2b, catering supplies, tableware, kitchen utensils, food containers, buffet & display equipment, restaurant accessories, buffet and catering supplies, e-commerce, enamelware, restaurant tableware, food presentation, buffet and display accessories, stainless steel cookware, restaurant signage, home furnishing merchant wholesalers, dinnerware, buffet display accessories, restaurant tableware sets, buffet display equipment, buffet trays, pizza pans, food presentation solutions, restaurant display equipment, bar tools, buffet risers, buffet and display equipment, food display stands, kitchen tools, tabletop accessories, restaurant display stands, food safety products, foodservice supplies, restaurant supplies, restaurant displayware, foodservice equipment & supplies, distribution, consumer products & retail, consumer internet, consumers, internet, information technology & services",http://www.linkedin.com/in/jackson-hays-4024b71a2,https://amnow.com,http://www.linkedin.com/company/american-metalcraft-inc-,https://facebook.com/americanmetalcraft,https://twitter.com/AmerMetalcraft,Chicago,Illinois,United States,"3708 North River Road, Franklin Park, Illinois, United States, 60131",Franklin Park,Illinois,United States,'+1 800-333-9133,"EasyDNS, Amazon SES, Outlook, MailChimp SPF, Microsoft Office 365, Zendesk, Hubspot, reCAPTCHA, Mobile Friendly, Nginx, Typekit, Google Maps (Non Paid Users), Woo Commerce, Bootstrap Framework, ShareThis, Google Maps, Gravity Forms, WordPress.org, Remote",5397000,"","","","","","","",false,false,false,false,"",3999,"42322, 332215",6a490bc05eee8e001815b3d0,6a490bbb50a14900100e3fc8,6a490bc05eee8e001815b3d0,"","","","","","","","",""
Kati,Paiz,Co-Owner / General Manager,Reprise Coffee Roasters,Reprise Coffee Roasters,kati@reprisecoffee.com,Verified,Apollo,Apollo,"","",2026-06-22T16:48:27+00:00,Owner,Operations,Operations,mike410123024@gmail.com,"","","",'+1 773-942-6230,"",false,Cold,"","",mike410123024@gmail.com,4,food & beverages,"coffee, coffee roaster, wholesale coffee, cafe, food & beverage services, coffee and tea manufacturing, coffee community, coffee & tea manufacturing, b2b, women in coffee, social responsibility, fermentation techniques, micro-lot coffee, fair trade coffee, rainforest preservation, coffee education, coffee craftsmanship, food & beverage, coffee environmental impact, coffee sourcing, sustainable practices, wholesale trade, community impact, coffee wholesale, direct trade, ethical sourcing, sustainable farming, coffee innovation, coffee quality, local cafes, e-commerce, direct farm relationships, consulting, social impact, community support, natural culturing process, specialty coffee awards, specialty coffee, coffee partnership, d2c, coffee retail, farm ownership, coffee subscription, coffee roasting, coffee culture, farm-to-cup, b2c, retail, micro-dosing caffeine, award-winning coffee, environmental sustainability, high-quality coffee, coffee shop, services, coffee fermentation science, manufacturing, distribution, consumer products & retail, food & beverages, consumer goods, consumers, consumer internet, internet, information technology & services, mechanical or industrial engineering",http://www.linkedin.com/in/kati-paiz,https://repriseroasters.com,http://www.linkedin.com/company/reprise-coffee-roasters,https://www.facebook.com/reprisecoffee,"",Chicago,Illinois,United States,"710 Main St, Evanston, Illinois, United States, 60202-1702",Evanston,Illinois,United States,'+1 773-942-6230,"Gmail, Google Apps, Microsoft Office 365, Amazon AWS, Mobile Friendly, Google Tag Manager, Squarespace ECommerce, Remote, Android, Circle, Toast, IoT, AI, Node.js","","","","","","","","",false,false,false,false,"",2099,31192,6a490bb8407646001c74b508,6a490bb6fe02c5001cfdcbc3,6a490bb8407646001c74b508,"","","","","","","","",""
Jason,Foster,Owner,Groundswell Coffee Roasters,Groundswell Coffee Roasters,jason.foster@groundswellcoffeeroasters.com,Verified,Apollo,Apollo,"",Not Catch-all,2026-06-29T18:55:49+00:00,Owner,"","",mike410123024@gmail.com,"","","",'+1 773-754-7590,"",false,Cold,"","",mike410123024@gmail.com,10,food & beverages,"brewing coffee, paninis, espresso, roasting coffee, panini39s, food & beverage services, colombia coffee, vibrant flavor coffee, staff training, food and beverage retail, cold brew coffee, coffee equipment, b2b, coffee and tea manufacturing, seasonal blends, d2c, retail, coffee quality control, b2c, specialty coffee, ethiopia coffee, coffee subscription, e-commerce, high-quality coffee beans, services, single-origin coffee, customer service, coffee testing, maritime character coffee, consulting, coffee roasting, coffee sourcing, coffee delivery, coffee wholesale, ethically sourced coffee, coffee roasting and distribution, coffee, small-batch roasting, distribution, consumer products & retail, food & beverages, consumer goods, consumers, food & beverage retail, consumer internet, internet, information technology & services, cafes, coffee & tea, coffee roasteries, food, restaurants",http://www.linkedin.com/in/jason-foster-84232428,https://groundswellcoffeeroasters.com,http://www.linkedin.com/company/groundswell-cafe,"","",Chicago,Illinois,United States,"4839 N Damen Ave, Chicago, Illinois, United States, 60625",Chicago,Illinois,United States,'+1 773-754-7590,"Google Search Console, GoDaddy Domains, Gmail, Google Apps, Square, Shopify Product Reviews, Shopify, Viewport Meta, Mobile Friendly, jQuery, Bold Commerce","","","","","","","","",false,false,false,false,1,"2099, 5812, 2096","722515, 311920",6a490bc534e805001839610d,6a490bc534e805001839610f,6a490bc534e805001839610d,"","","","","","","","",""
Sarah,Burke,Category Manager,Keurig Dr Pepper Inc.,Keurig Dr Pepper,sarah.burke@kdrp.com,Verified,Apollo,Apollo,"",Not Catch-all,2026-06-23T16:30:02+00:00,Manager,"Marketing, Sales","",mike410123024@gmail.com,"","","","","",false,Cold,"","",mike410123024@gmail.com,29000,food & beverages,"beverages (production/distribution), consumer staples, food & beverage services, brand licensing, product innovation, environmental standards, beverage technology, beverage packaging, keurig brewing system, north american market, distribution channels, premium beverages, product portfolio, distribution & logistics, coffee products, b2c, market expansion, soft drinks, publicly traded, single-serve brewing, flavor innovation, brand portfolio, coffee, k-cup innovation, specialty coffee, beverage industry, sustainability, brand awareness, consumer health, energy drinks, retail, soft drink and ice manufacturing, beverage manufacturing, product formulation, sustainability initiatives, retail distribution, on-the-go beverages, innovation, keurig single-serve system, e-commerce, b2b, supply chain, beverage categories, food and beverage retail, consumer goods, market presence, customer engagement, merger and acquisition, product customization, non-carbonated beverages, carbonated drinks, beverage sustainability, water, employee benefits, consumer products, product development, ready-to-drink beverages, k-cup pods, product diversification, hot and cold beverages, beverage company, tea, mixers, distribution capabilities, k-cup, recycling program, corporate responsibility, health and well-being, global consumer, diversity and inclusion, team culture, job opportunities, community impact, customer satisfaction, retail partnerships, wholesale distribution, consumer engagement, team building, empowerment, environmental sustainability, employee resources, caffeine beverages, refreshing drinks, beverage marketing, iconic brands, keurig systems, safety standards, quality control, manufacturing sites, mentorship programs, leadership opportunities, corporate governance, impactful stories, financial performance, community support, strategic growth, market leadership, consumer trends, manufacturing, distribution, consumer products & retail, transportation & logistics, food & beverages, consumers, environmental services, renewables & environment, food production, consumer internet, internet, information technology & services, food & beverage retail, natural resources, mechanical or industrial engineering",http://www.linkedin.com/in/saraheileenburke7,https://keurigdrpepper.com,http://www.linkedin.com/company/keurig-dr-pepper-inc,https://facebook.com/DrPepper,https://twitter.com/drpepper,Chicago,Illinois,United States,"53 South Avenue, Burlington, Massachusetts, United States, 01803",Burlington,Massachusetts,United States,"","Apple Business Manager, AWS Cloud, Amazon CloudFront, AWS Public Cloud, Amazon Route 53, UltraDns, Apple School Manager, Microsoft Email Providers, Microsoft Exchange Online, Outlook, Microsoft 365, Microsoft 365 Apps & Services, Microsoft Exchange, Office365, Amazon AWS, NeuStar, Microsoft Office 365, Proofpoint, Proofpoint Email Security and Protection, Akamai CDN Solutions, Akamai, Akamai Web Application & API Protector, Amazon AWS, Amazon Route 53, Salesforce, Cloudflare DNS, Rackspace Email, CloudFlare Hosting, Pantheon, The Trade Desk, iCIMS, Slack, Netlify, Amazon SES, Salesforce Service Cloud, Salesforce Live Agent, Bluekai, Google Analytics 4 (GA4), Wordpress, Google Analytics, Tealium, Akamai App & API Protector, LinkedIn Ads, PrimeNG, Google Search Console, Linkedin Marketing Solutions, Viewport Meta, Oracle Visual Builder Cloud Service, Google Search Central, Boomerang JS library, HREF Lang, Bootstrapcdn, WordPress.org, Tealium iQ Tag Management, Google Tag Manager, SOASTA, Tealium Customer Data Hub, Nginx, Bootstrap Framework, Mobile Friendly, Bootstrap Framework v3.1.1, Akamai mPulse, Tealium AudienceStream CDP, Remote, AI, Gusto, INAP, Microsoft Office, HireVue, PeopleSoft Sales, dbt, Snow, Snowflake, Databricks, Fivetran, Informatica Cloud Mass Ingestion, Azure Data Factory, Airflow, Git, MySQL, Python, Electron, PowerBI Tiles, SAP, Alteryx, DAX, BASE, Ning, IAPPS, Kronos, ADP, Oracle Siebel, Strategy (formerly MicroStrategy), Cognos TM1, Appier AIRIS (formerly Woopra), Activa, Apache Spark, Delta Lake, OpenAI, Excel4Apps, Revel iPad POS, Apple iPhone, TikTok, Instagram, Pinterest, YouTube, Facebook, ConnectWise Control, AVEVA InTouch HMI, Amazon Managed Streaming for Apache Kafka (Amazon MSK), Salesforce Einstein AI, Microsoft PowerPoint, MAX by AppLovin, SAP Ariba, Salesforce Commerce Cloud, ServiceNow, Jabra Headsets And Speakerphones, Gem, Percipio, Act!, HPLC, ArtiosCAD, Microsoft Sharepoint, Olo, Postpresso, eMaint CMMS, Siemens SIMATIC HMI (Human Machine Interface), AC500 PLC, SS&C, AMP, LEAP, Workday, Kainos, Beeline, Microsoft Excel, Tor, Apple OS X Yosemite, Box, eBay, SAP ECC, IBM DataPower Gateway, AutoCAD, Dassault SOLIDWORKS, SAP Customer Care and Service (CCS), , SAP NetWeaver, SAP HANA, Oracle Fusion Middleware, Google Cloud APIs, Microsoft PowerShell, Jira, Atlassian Confluence, FactoryTalk, Coralogix, Glassbox, SMART Board, Route, Star, CAT, Nielsen Ad Intel, BMC Helix Discovery, Shopp, JDA, Idera SQL Diagnostic Manager, Perfecto, Google AdWords Conversion, Salesforce CRM Analytics, Veeam ONE, mabl, Motorola, Freelance Distributed Control System (DCS), Inventor, Planview LeanKit, ABB Distributed Control Systems (DCS), Khoros for SAP Customer Experience Cloud, Mulesoft, Archibus, Mode, LOU, Concur, Copilot, Microsoft Power Automate, Microsoft Power Platform, Excel Impact, POINT, Zipteams, IBM Cognos Analytics, Oracle XML DB, Docebo, Yahoo Ad Manager, Micro, AWS Application Load Balancer, FIS, Visio, VMware View Manager, YieldBot, SAP Data Maintenance for ERP by Vistex, Yandex Metrica, WMS, SAP Material Requirement Planning (MRP), TrackWise, Apple iPad, .GIS, Homestead, Veeam, Power BI Documenter, SAP ERP, Automic Automation, CNC Software, GRIN, Glide, FRAC Pumps, Liquid, Quip, Workvivo, Informatica, SEEBURGER Business Integration Suite, GoToAssist, Delta Sharing, AWS Transfer for SFTP, blend, SteamVR, Truckstop Load Board, Cash App, OpenProject, Microsoft Teams, AVEVA PDMS, IQMS, ETQ Reliance QMS, Agile GCP Labs, Oracle GRC, GoToAssist, Eightfold AI, Tableau, Nielsen NetRatings, 24-7 Media, Sigma, Microsoft AdCenter, AWS Database Migration Service, Shopify, .NET, ICE, Westlaw, Microsoft Word, Microsoft Project, Microsoft Power Apps, Thomson Reuters Westlaw, Google Cloud BigQuery, Azure Synapse, WebAwesome",16603000000,"","","","",JAB HOLDING COMPANY LLC (jabholco.com),JAB HOLDING COMPANY LLC (jabholco.com),"",false,false,false,false,"","2086, 2095, 3634","311920, 312111, 335210",6a490bddd1ae6d000c094195,6a490bb767660800207faddb,6a490bddd1ae6d000c094195,"","","","","","","","",""
Laura,Nieciag,Buyer,"American Metalcraft, Inc.",American Metalcraft,lnieciag@amnow.com,Verified,Apollo,Apollo,"","",2026-06-03T07:21:38+00:00,Entry,Finance,Sourcing / Procurement,mike410123024@gmail.com,"","","",'+1 800-333-9133,"",false,Cold,"","",mike410123024@gmail.com,51,business supplies & equipment,"tabletop & buffet supplies, bar supplies, pizza trays, kitchen supplies, pizza trays pizza supplies plate covers tabletop & buffet supplies bar supplies kitchen supplies, plate covers, pizza supplies, food presentation domes, buffet accessories, retail, restaurant display items, food safety, food paper and cups, buffet display solutions, foodservice equipment, restaurant equipment, buffet and display, food display risers, buffet display tools, melamine dinnerware, food storage containers, buffet display, buffet display items, food presentation tools, buffet display risers, buffet display trays, restaurant equipment & supplies, food safety dispensers, glassware, restaurant buffet accessories, buffet warmers, foodservice products, buffetware, bar tools and accessories, food presentation accessories, food presentation equipment, kitchenware & cookware, food presentation & display, restaurant products, b2b, catering supplies, tableware, kitchen utensils, food containers, buffet & display equipment, restaurant accessories, buffet and catering supplies, e-commerce, enamelware, restaurant tableware, food presentation, buffet and display accessories, stainless steel cookware, restaurant signage, home furnishing merchant wholesalers, dinnerware, buffet display accessories, restaurant tableware sets, buffet display equipment, buffet trays, pizza pans, food presentation solutions, restaurant display equipment, bar tools, buffet risers, buffet and display equipment, food display stands, kitchen tools, tabletop accessories, restaurant display stands, food safety products, foodservice supplies, restaurant supplies, restaurant displayware, foodservice equipment & supplies, distribution, consumer products & retail, consumer internet, consumers, internet, information technology & services",http://www.linkedin.com/in/laura-nieciag-0b6aa7b,https://amnow.com,http://www.linkedin.com/company/american-metalcraft-inc-,https://facebook.com/americanmetalcraft,https://twitter.com/AmerMetalcraft,Bolingbrook,Illinois,United States,"3708 North River Road, Franklin Park, Illinois, United States, 60131",Franklin Park,Illinois,United States,'+1 800-333-9133,"EasyDNS, Amazon SES, Outlook, MailChimp SPF, Microsoft Office 365, Zendesk, Hubspot, reCAPTCHA, Mobile Friendly, Nginx, Typekit, Google Maps (Non Paid Users), Woo Commerce, Bootstrap Framework, ShareThis, Google Maps, Gravity Forms, WordPress.org, Remote",5397000,"","","","","","","",false,false,false,false,"",3999,"42322, 332215",6a490bc1efc63b0010f9b4f5,6a490bbb50a14900100e3fc8,6a490bc1efc63b0010f9b4f5,"","","","","","","","",""
Jennifer,Hughey,CEO/Owner,Goshen Coffee Roasters,Goshen Coffee Roasters,jennifer@goshencoffee.com,Verified,Apollo,Apollo,"",Not Catch-all,2026-06-14T14:14:38+00:00,Owner,C-Suite,Executive,mike410123024@gmail.com,"","","",'+1 618-659-0571,"",false,Cold,"","",mike410123024@gmail.com,16,food production,"food & beverage manufacturing, b2c, sample sets, coffee packaging, limited edition coffee, customer service, d2c, coffee blends, gift bundles, coffee quality, e-commerce, retail, decaf coffee, coffee gear, food and beverage, coffee tasting, colombia martha reina, coffee subscriptions, coffee brewing guides, subscription, secret stash coffee, sample set, wholesale, single origin beans, timor-leste lebudu kraik, other specialty food retailers, coffee products, b2b, kenya mbegu ndogo, whole beans, ground coffee, coffee awards, accessories, coffee roaster, papua new guinea jiwaka, single origin ethiopia, retail coffee, coffee sourcing, whole bean, sumatra bebagi kepada, coffee tasting sets, blend, coffee, wholesale coffee, coffee education, coffee subscription boxes, coffee shop, single origin, award-winning coffee, seasonal coffee blends, seasonal coffee, coffee shop supplies, coffee delivery, shipping, coffee accessories, distribution, consumer products & retail, food production, consumer internet, consumers, internet, information technology & services, food & beverages, consumer goods, logistics & supply chain",http://www.linkedin.com/in/jenniferahughey,https://goshencoffee.com,http://www.linkedin.com/company/goshen-coffee,https://facebook.com/GoshenCoffee,https://twitter.com/goshencoffee,Chicago,Illinois,United States,"206 E Linden St, Edwardsville, Illinois, United States, 62025-2044",Edwardsville,Illinois,United States,'+1 618-659-0571,"Gmail, Google Apps, Google Search Console, Mobile Friendly, Viewport Meta, Google Tag Manager, Shopify, Gusto, Remote, Circle, AI",11723000,"","","","","","","",false,false,false,false,"",2099,"44529, 311920, 722515, 424490",6a490bc734e8050018396137,6a490bc734e8050018396139,6a490bc734e8050018396137,jennifer_hughey@yahoo.com,Apollo,Verified,Apollo,"","","","",""
Jon,Shalen,President,Espresso Soci,Espresso Soci,jon@espressosoci.com,Verified,Apollo,Apollo,"","",2026-06-22T19:06:19+00:00,Vp,"","",mike410123024@gmail.com,"","","",'+1 219-922-7504,"",false,Cold,"","",mike410123024@gmail.com,3,food & beverages,"exclusivitea, traditional espresso machines, spare parts, super automatic espresso machines, tonino lamborghini coffee, food & beverage services, consulting, food and beverage equipment manufacturing, custom coffee solutions, water treatment supplies, coffee equipment support, coffee equipment, coffee machine maintenance, coffee machine support network, coffee, espresso equipment, industrial machinery manufacturing, wholesale trade, b2b, high-quality coffee equipment, professional coffee solutions, coffee industry expertise, retail trade, coffee machine support, coffee industry partnerships, coffee grinders, coffee machine partnerships, services, espresso machines, reliable coffee machines, commercial coffee equipment, customer service, precision-engineered espresso machines, distribution, food & beverages, consumer goods, consumers",http://www.linkedin.com/in/jonshalen-faema-cimbali-toninolamborghinicoffee,https://espressosoci.com,http://www.linkedin.com/company/espresso-soci,https://www.facebook.com/search/top/,"",Chicago,Illinois,United States,"442 State St, Calumet City, Illinois, United States, 60409",Calumet City,Illinois,United States,'+1 219-922-7504,"GoDaddy Domains, Microsoft Email Providers, Microsoft Exchange Online, Outlook, Microsoft 365, Microsoft 365 Apps & Services, Microsoft Exchange, Office365, GoDaddy Hosting, Microsoft Office 365, Slack, Viewport Meta, Yahoo User Interface, Woo Commerce, Yoast, Google Maps, amCharts, Amcharts JS Library, WordPress.org, Google Font API, Gravity Forms, YouTube, Mobile Friendly, Wordpress, PrimeNG, Babel, Google Maps Platform, Remote, Circle","","","","","","","","",false,false,false,false,"",3631,33324,6a490bc967660800207fae73,6a490bca67660800207fae75,6a490bc967660800207fae73,"","","","","","","","",""
